{
  "event_id": "3c4d5e6f-7a8b-9012-cdef-a34567890123",
  "event_type": "POLICY_CREATED",
  "event_category": "policy-lifecycle",
  "event_time": "2025-02-01T08:30:00.000Z",
  "agent_id": "agent.governance-admin",
  "agent_name": "Governance Admin",
  "org_id": "org.carepoint-health",
  "org_name": "CarePoint Health Systems",
  "policy_id": "pol-201",
  "policy_name": "policy.hipaa-patient-consent",
  "policy_version": 1,
  "prompt_id": "",
  "prompt_name": "",
  "prompt_version": 0,
  "governance_hash": "c5d6e7f8a9b0c1d2e3f4a5b6c7d8e9f0a1b2c3d4e5f6a7b8c9d0e1f2a3b4c5d6",
  "hash_type": "sha256",
  "trace_id": "e56fa789-b012-34cd-ef56-ab78cd901234",
  "data_classification": "restricted",
  "template_rendered": false,
  "denial_reason": "",
  "violation_type": "",
  "severity": "",
  "source_ip": "172.20.1.10",
  "request_method": "POST",
  "request_path": "/api/policies",
  "ingested_at": "2025-02-01T08:30:00.567Z",
  "annotations": {
    "created_by": "ciso@carepoint-health.com",
    "regulatory_hooks": [
      "HIPAA",
      "HITECH"
    ],
    "description": "Patient consent rules governing PHI access by AI agents",
    "linked_agents": [
      "agent.patient-intake",
      "agent.triage-assistant"
    ]
  },
  "sequence_number": 1
}
