{
  "event_id": "d4e5f6a7-b8c9-0123-def0-234567890123",
  "event_type": "POLICY_VIOLATION",
  "event_category": "policy",
  "event_time": "2025-01-15T16:45:00.321Z",
  "agent_id": "agent.research-assistant",
  "agent_name": "Research Assistant",
  "org_id": "org.finco",
  "org_name": "FinCo",
  "policy_id": "pol-007",
  "policy_name": "policy.pre-release-earnings",
  "policy_version": 2,
  "prompt_id": "",
  "prompt_name": "",
  "prompt_version": 0,
  "governance_hash": "e7f8a9b0c1d2e3f4a5b6c7d8e9f0a1b2c3d4e5f6a7b8c9d0e1f2a3b4c5d6e7f8",
  "hash_type": "sha256",
  "trace_id": "883gb733-h5ce-74g7-d049-779988773333",
  "data_classification": "restricted",
  "template_rendered": false,
  "denial_reason": "Restricted data accessed outside approved window",
  "violation_type": "DATA_CLASSIFICATION_BREACH",
  "severity": "critical",
  "source_ip": "10.0.2.88",
  "request_method": "GET",
  "request_path": "/api/policies/pre-release-earnings/content",
  "ingested_at": "2025-01-15T16:45:00.890Z",
  "annotations": {
    "regulatory_hooks": [
      "SEC",
      "FINRA"
    ],
    "escalated_to": "compliance-team@finco.com",
    "auto_blocked": true
  },
  "sequence_number": 1
}
