{
  "event_id": "e2f3a4b5-c6d7-8901-abcd-ef0123456789",
  "event_type": "MEMORY_WRITTEN",
  "event_category": "memory",
  "event_time": "2026-02-15T14:30:01.789Z",
  "agent_id": "agent.trading-bot-v2",
  "agent_name": "Trading Bot",
  "org_id": "org.finco",
  "org_name": "FinCo",
  "policy_id": "",
  "policy_name": "",
  "policy_version": 0,
  "prompt_id": "",
  "prompt_name": "",
  "prompt_version": 0,
  "governance_hash": "e7e28abb355128754dc081498976a4bc7d2c4fdc782b9b09181a6a0f30201bac",
  "hash_type": "sha256",
  "trace_id": "4bf92f3577b34da6a3ce929d0e0e4736",
  "span_id": "11f067bb1ba902c8",
  "parent_span_id": "00f067aa0ba902b7",
  "trace_flags": "01",
  "data_classification": "confidential",
  "template_rendered": false,
  "denial_reason": "",
  "violation_type": "",
  "severity": "",
  "source_ip": "",
  "request_method": "",
  "request_path": "",
  "query_hash": "",
  "previous_hash": "dc9d08cfeb67f8cba1db7bf316f49f4c40293b89b196d29a1f5cb9aba4a8fb52",
  "annotations": {
    "memory_type": "agent-state",
    "operation": "update-portfolio"
  },
  "spec_version": "0.12",
  "sequence_number": 1
}
