{
  "event_id": "8b9c0d1e-2f3a-4567-bcde-f89012345678",
  "event_type": "GOVERNANCE_PROOF",
  "event_category": "governance-proof",
  "event_time": "2025-02-20T22:10:45.678Z",
  "agent_id": "agent.trading-bot-v2",
  "agent_name": "Trading Bot",
  "org_id": "org.finco",
  "org_name": "FinCo",
  "policy_id": "pol-001",
  "policy_name": "policy.trading-limits",
  "policy_version": 4,
  "prompt_id": "",
  "prompt_name": "",
  "prompt_version": 0,
  "governance_hash": "a3f2b8c1d4e5f67890abcdef1234567890abcdef1234567890abcdef12345678",
  "hash_type": "sha256",
  "trace_id": "d01ef234-a567-89bc-de01-fa23bc456789",
  "data_classification": "confidential",
  "template_rendered": true,
  "denial_reason": "",
  "violation_type": "",
  "severity": "",
  "source_ip": "10.0.1.42",
  "request_method": "GET",
  "request_path": "/api/policies/trading-limits/content",
  "ingested_at": "2025-02-20T22:10:46.012Z",
  "annotations": {
    "regulatory_hooks": [
      "FINRA",
      "SEC"
    ],
    "proof_type": "content_delivery",
    "recipient_agent": "agent.trading-bot-v2"
  },
  "spec_version": "0.11",
  "sequence_number": 1
}
