{
  "event_id": "0d1e2f3a-4b5c-6789-defa-b01234567890",
  "event_type": "INJECT_SUCCESS",
  "event_category": "inject",
  "event_time": "2025-02-25T07:15:00.123Z",
  "agent_id": "agent.patient-intake",
  "agent_name": "Patient Intake Assistant",
  "org_id": "org.carepoint-health",
  "org_name": "CarePoint Health Systems",
  "policy_id": "pol-201",
  "policy_name": "policy.hipaa-patient-consent",
  "policy_version": 2,
  "prompt_id": "",
  "prompt_name": "",
  "prompt_version": 0,
  "governance_hash": "2b3c4d5e6f7a8b9c0d1e2f3a4b5c6d7e8f9a0b1c2d3e4f5a6b7c8d9e0f1a2b3c",
  "hash_type": "sha256",
  "trace_id": "f23ab456-c789-01de-fa23-bc45de678901",
  "data_classification": "restricted",
  "template_rendered": true,
  "denial_reason": "",
  "violation_type": "",
  "severity": "",
  "source_ip": "172.20.1.55",
  "request_method": "GET",
  "request_path": "/api/policies/hipaa-patient-consent/content",
  "ingested_at": "2025-02-25T07:15:00.678Z",
  "annotations": {
    "regulatory_hooks": [
      "HIPAA",
      "HITECH",
      "42-CFR-Part-2"
    ],
    "delivery_latency_ms": 14,
    "phi_access_level": "minimum-necessary",
    "consent_type": "treatment-payment-operations",
    "patient_record_id_hash": "9f86d081884c7d659a2feaa0c55ad015a3bf4f1b2b0b822cd15d6c15b0f00a08",
    "requesting_department": "emergency-medicine",
    "audit_trail_ref": "s3://carepoint-hipaa-logs/2025/02/25/intake-f23ab456.json"
  },
  "sequence_number": 1
}
