{
  "event_id": "d4e5f678-9abc-4def-8123-556677889900",
  "event_type": "MEMORY_READ",
  "event_category": "memory",
  "event_time": "2026-02-20T11:41:30.456Z",
  "agent_id": "agent.clinical-triage",
  "agent_name": "Clinical Triage Agent",
  "org_id": "org.hospital-group",
  "org_name": "Hospital Group",
  "policy_id": "pol-phi-access",
  "policy_name": "policy.phi-access-controls",
  "policy_version": 7,
  "prompt_id": "",
  "prompt_name": "",
  "prompt_version": 0,
  "governance_hash": "ccddeeff00112233445566778899aabbccddeeff00112233445566778899aabb",
  "hash_type": "merkle-sha256",
  "trace_id": "550e8400-e29b-41d4-a716-446655440000",
  "span_id": "00f067aa0ba902b8",
  "parent_span_id": "00f067aa0ba902b7",
  "trace_flags": "01",
  "data_classification": "restricted",
  "template_rendered": false,
  "denial_reason": "",
  "violation_type": "",
  "severity": "",
  "source_ip": "",
  "request_method": "POST",
  "request_path": "/memory/read",
  "ingested_at": "2026-02-20T11:41:30.510Z",
  "annotations": {
    "privacy_profile": "hipaa",
    "salt_rotation_window": "24h"
  },
  "query_hash": "1234567890abcdef1234567890abcdef1234567890abcdef1234567890abcdef",
  "previous_hash": "",
  "event_signature": "",
  "signature_key_id": "",
  "sequence_number": 12,
  "causality_ref": "b7a6c5d4-3333-4444-9555-666666666666",
  "spec_version": "0.12",
  "governance_merkle_tree": {
    "algorithm": "sha256",
    "leaf_count": 2,
    "leaves": [
      {
        "resource_type": "policy",
        "resource_name": "policy.phi-access-controls",
        "hash": "11aa22bb33cc44dd55ee66ff7788990011aa22bb33cc44dd55ee66ff77889900",
        "hash_mode": "content"
      },
      {
        "resource_type": "memory",
        "resource_name": "memory.session-42.user-prompt",
        "hash": "22bb33cc44dd55ee66ff7788990011aa22bb33cc44dd55ee66ff7788990011aa",
        "hash_mode": "content",
        "is_salted": true,
        "salt_ref": "kms://vault/salts/session-42-nonce"
      }
    ],
    "inclusion_proofs": [
      {
        "leaf_hash": "22bb33cc44dd55ee66ff7788990011aa22bb33cc44dd55ee66ff7788990011aa",
        "proof_path": [
          {
            "sibling_hash": "11aa22bb33cc44dd55ee66ff7788990011aa22bb33cc44dd55ee66ff77889900",
            "sibling_position": "left"
          }
        ]
      }
    ]
  }
}
