{
  "event_id": "d1e2f3a4-b5c6-7890-abcd-ef0123456789",
  "event_type": "MEMORY_READ",
  "event_category": "memory",
  "event_time": "2026-02-15T14:30:00.456Z",
  "agent_id": "agent.trading-bot-v2",
  "agent_name": "Trading Bot",
  "org_id": "org.finco",
  "org_name": "FinCo",
  "governance_hash": "b0fbf599e03e3893cca8f217a86d581e98f85b5fa9b31cfa3f852de5d92d23b8",
  "hash_type": "sha256",
  "trace_id": "4bf92f3577b34da6a3ce929d0e0e4736",
  "span_id": "00f067aa0ba902b7",
  "parent_span_id": "",
  "trace_flags": "01",
  "data_classification": "confidential",
  "denial_reason": "",
  "violation_type": "",
  "severity": "",
  "request_method": "",
  "request_path": "",
  "annotations": {
    "memory_type": "conversation-history",
    "retrieval_method": "semantic-search",
    "result_count": 5
  },
  "spec_version": "0.13",
  "sequence_number": 1
}
