{
  "event_id": "b2c3d4e5-f6a7-8901-bcde-f12345678901",
  "event_type": "INJECT_DENIED",
  "event_category": "inject",
  "event_time": "2025-01-15T14:31:00.789Z",
  "agent_id": "agent.marketing-assistant",
  "agent_name": "Marketing Assistant",
  "org_id": "org.finco",
  "org_name": "FinCo",
  "governance_hash": "",
  "hash_type": "sha256",
  "trace_id": "661f9511-f3ac-52e5-b827-557766551111",
  "data_classification": "confidential",
  "denial_reason": "Agent agent.marketing-assistant is not linked to policy policy.trading-limits",
  "violation_type": "ACCESS_CONTROL",
  "severity": "medium",
  "request_method": "GET",
  "request_path": "/api/policies/trading-limits/content",
  "ingested_at": "2025-01-15T14:31:01.234Z",
  "annotations": {},
  "sequence_number": 1
}
