{
  "event_id": "b2c3d4e5-f6a7-8901-bcde-f23456789012",
  "event_type": "INJECT_SUCCESS",
  "event_category": "inject",
  "event_time": "2026-02-15T10:30:00.456Z",
  "agent_id": "agent.trading-bot-v2",
  "agent_name": "Trading Bot",
  "org_id": "org.finco",
  "org_name": "FinCo",
  "policy_id": "pol-001",
  "policy_name": "policy.trading-limits",
  "policy_version": 4,
  "prompt_id": "",
  "prompt_name": "",
  "prompt_version": 0,
  "governance_hash": "a3f2b8c1d4e5f67890abcdef1234567890abcdef1234567890abcdef12345678",
  "hash_type": "sha256",
  "trace_id": "4bf92f3577b34da6a3ce929d0e0e4736",
  "span_id": "00f067aa0ba902b7",
  "parent_span_id": "a1b2c3d4e5f6a7b8",
  "trace_flags": "01",
  "data_classification": "confidential",
  "template_rendered": true,
  "denial_reason": "",
  "violation_type": "",
  "severity": "",
  "source_ip": "10.0.1.42",
  "request_method": "GET",
  "request_path": "/api/policies/trading-limits/content",
  "ingested_at": "2026-02-15T10:30:01.789Z",
  "annotations": {
    "regulatory_hooks": [
      "FINRA",
      "SEC"
    ]
  },
  "spec_version": "0.11",
  "sequence_number": 1
}
