{
  "event_id": "4d5e6f7a-8b9c-0123-defa-b45678901234",
  "event_type": "POLICY_VERSION_APPROVED",
  "event_category": "policy-lifecycle",
  "event_time": "2025-02-14T14:00:00.000Z",
  "agent_id": "agent.governance-admin",
  "agent_name": "Governance Admin",
  "org_id": "org.vanguard-ecommerce",
  "org_name": "Vanguard E-Commerce",
  "governance_hash": "d6e7f8a9b0c1d2e3f4a5b6c7d8e9f0a1b2c3d4e5f6a7b8c9d0e1f2a3b4c5d6e7",
  "hash_type": "sha256",
  "trace_id": "f67ab890-c123-45de-fa67-bc89de012345",
  "data_classification": "internal",
  "denial_reason": "",
  "violation_type": "",
  "severity": "",
  "request_method": "POST",
  "request_path": "/api/policies/pol-305/versions/ver-003/approve",
  "ingested_at": "2025-02-14T14:00:01.234Z",
  "annotations": {
    "approved_by": "legal-ops@vanguard-ecommerce.com",
    "regulatory_hooks": [
      "GDPR",
      "EU-CRA"
    ],
    "changelog": "Updated 14-day return window to 30-day for digital goods per EU directive 2025/114",
    "previous_version": "ver-002"
  },
  "sequence_number": 1
}
