{
  "event_id": "9c0d1e2f-3a4b-5678-cdef-a90123456789",
  "event_type": "A2A_CALL",
  "event_category": "audit",
  "event_time": "2025-02-18T13:45:22.345Z",
  "agent_id": "agent.order-fulfillment",
  "agent_name": "Order Fulfillment Agent",
  "org_id": "org.summit-retail",
  "org_name": "Summit Retail",
  "governance_hash": "1a2b3c4d5e6f7a8b9c0d1e2f3a4b5c6d7e8f9a0b1c2d3e4f5a6b7c8d9e0f1a2b",
  "hash_type": "sha256",
  "trace_id": "e12fa345-b678-90cd-ef12-ab34cd567890",
  "data_classification": "internal",
  "denial_reason": "",
  "violation_type": "",
  "severity": "",
  "request_method": "A2A",
  "request_path": "/.well-known/agent.json",
  "ingested_at": "2025-02-18T13:45:22.890Z",
  "annotations": {
    "target_agent": "agent.shipping-calculator",
    "target_org": "org.summit-retail",
    "a2a_method": "tasks/send",
    "task_id": "task-78231",
    "request_payload_bytes": 1240,
    "response_status": "completed",
    "response_latency_ms": 340,
    "items_in_order": 3
  },
  "sequence_number": 1
}
