{
  "event_id": "b5c6d7e8-f9a0-1234-abcd-ef0123456789",
  "event_type": "MODEL_LOADED",
  "event_category": "model",
  "event_time": "2026-02-15T14:29:59.000Z",
  "agent_id": "agent.trading-bot-v2",
  "agent_name": "Trading Bot",
  "org_id": "org.finco",
  "org_name": "FinCo",
  "governance_hash": "ba25f42d5a3077006b95ebdfebc3248662eac2e24ba113ed3832d6e316add718",
  "hash_type": "sha256",
  "trace_id": "4bf92f3577b34da6a3ce929d0e0e4736",
  "span_id": "44f067ee4ba902fb",
  "parent_span_id": "",
  "trace_flags": "01",
  "data_classification": "internal",
  "denial_reason": "",
  "violation_type": "",
  "severity": "",
  "request_method": "",
  "request_path": "",
  "annotations": {
    "provider": "openai",
    "model_name": "gpt-4",
    "model_version": "2024-01",
    "purpose": "trading-analysis",
    "quantization": "none"
  },
  "spec_version": "0.13",
  "sequence_number": 1
}
